{
  "tagline": "Software Engineer · AI Agent Specialist · 4+ Years",
  "summary": "Software Engineer specializing in scalable backend systems, AI-driven automation, and multi-agent orchestration. Building production-grade platforms with Python, TypeScript, React, and cloud-native architectures.",
  "extendedSummary": "Results-oriented Software Engineer with extensive experience across the full SDLC, specializing in scalable backend architectures, full-stack development, AI Agent & Multi-Agent Systems, AI-driven automation, and cloud-native deployments. Proficient in modern Python and JavaScript/TypeScript ecosystems (React, Node.js, FastAPI, Astro) with deep expertise in Agentic AI Frameworks (LangChain, LangGraph, AutoGen, CrewAI), Microservices, Serverless Architectures, DevOps, and Security Engineering.",
  "valueProposition": [
    {
      "title": "Backend & AI Systems",
      "description": "Scalable APIs, multi-agent orchestration, RAG pipelines, and production ML deployments.",
      "icon": "server"
    },
    {
      "title": "Full-Stack Engineering",
      "description": "React, Astro, Node.js — from pixel-perfect UIs to high-throughput data pipelines.",
      "icon": "layers"
    },
    {
      "title": "Cloud & DevOps",
      "description": "AWS, Cloudflare, Docker, Kubernetes, CI/CD — zero-downtime deployments at scale.",
      "icon": "cloud"
    }
  ],
  "availability": {
    "status": "available",
    "message": "Open to new opportunities",
    "preferredRoles": [
      "Software Engineer",
      "Backend Engineer",
      "AI/ML Engineer",
      "Full-Stack Engineer"
    ]
  },
  "skills": [
    {
      "category": "Languages",
      "items": [
        "Python (Advanced)",
        "TypeScript",
        "JavaScript",
        "SQL (PostgreSQL, MySQL, LibSQL)",
        "HTML5",
        "CSS3"
      ]
    },
    {
      "category": "Backend & Cloud",
      "items": [
        "FastAPI",
        "Node.js",
        "Django",
        "GraphQL",
        "Kafka",
        "Redis",
        "Upstash Redis",
        "AWS (Lambda, EKS, S3)",
        "Cloudflare Workers",
        "Docker",
        "Kubernetes",
        "Terraform"
      ]
    },
    {
      "category": "Frontend & Full Stack",
      "items": [
        "React.js",
        "Astro",
        "Tailwind CSS",
        "Redux",
        "Chart.js",
        "MDX",
        "RESTful APIs",
        "Microservices Architecture",
        "Serverless Architectures",
        "PWA"
      ]
    },
    {
      "category": "AI Agents & Agentic Systems",
      "items": [
        "LangGraph",
        "LangChain Agents",
        "AutoGen",
        "CrewAI",
        "ReAct Agents",
        "Tool-Use Agents",
        "Multi-Agent Orchestration",
        "Agent Memory (Short/Long-Term)",
        "Agent Planning & Reasoning",
        "Reflection & Self-Critique Loops",
        "Human-in-the-Loop (HITL) Agents",
        "Agentic RAG",
        "MCP (Model Context Protocol)",
        "Function Calling",
        "Code Execution Agents",
        "Browser-Use Agents",
        "Computer-Use Agents"
      ]
    },
    {
      "category": "AI & Data Engineering",
      "items": [
        "LangChain",
        "RAG Pipelines",
        "Agentic RAG",
        "Vector DBs (Milvus/Chroma/Pinecone)",
        "Hugging Face",
        "Google Gemini",
        "Groq",
        "Mistral AI",
        "Cohere",
        "NVIDIA NIM",
        "Puter.js",
        "Multi-Provider LLM Integration",
        "ETL Pipelines",
        "PyTorch",
        "Fine-Tuning (LoRA/QLoRA)",
        "Prompt Engineering",
        "Web Scraping (BeautifulSoup/Cheerio)"
      ]
    },
    {
      "category": "Databases & Storage",
      "items": [
        "Firebase Firestore",
        "Supabase (PostgreSQL)",
        "MongoDB",
        "Turso (LibSQL)",
        "Upstash Redis",
        "Cloudflare R2 (S3-Compatible)",
        "Sanity CMS",
        "Algolia Search",
        "Neo4j (Graph DB for Agent Memory)"
      ]
    },
    {
      "category": "DevOps & CI/CD",
      "items": [
        "GitHub Actions",
        "Jenkins",
        "Cloudflare Pages Deployment",
        "Wrangler CLI",
        "Cron-Scheduled Workflows",
        "Infrastructure as Code (IaC)",
        "Docker",
        "Kubernetes",
        "Linux Admin"
      ]
    },
    {
      "category": "Security & Auth",
      "items": [
        "Kinde Auth",
        "Firebase Auth",
        "OAuth 2.0 (PKCE)",
        "reCAPTCHA v3",
        "Client-Side Encryption (AES/DES/3DES/RC4)",
        "Bcrypt",
        "40+ Cryptographic Hash Algorithms",
        "OWASP",
        "DevSecOps",
        "Secure Coding"
      ]
    },
    {
      "category": "Payments & Analytics",
      "items": [
        "Razorpay (Orders, Webhooks, Verification)",
        "PostHog Analytics",
        "Google AdSense",
        "OneSignal Push Notifications",
        "Cloudinary Media Optimization"
      ]
    },
    {
      "category": "Core Competencies",
      "items": [
        "System Design (HLD/LLD)",
        "OOP",
        "SOLID Principles",
        "Distributed Systems",
        "Modular Architecture",
        "Agentic Workflow Design",
        "Unit/Integration Testing",
        "TDD",
        "Agile Methodologies"
      ]
    }
  ],
  "experience": [
    {
      "title": "Software Engineer",
      "company": "Tata Consultancy Services (TCS)",
      "location": "Bhubaneswar, India",
      "date": "Jun. 2025 - Present",
      "items": [
        "Optimized enterprise-scale pricing engines and business logic using Python, reducing processing latency by 60% for high-volume transactions.",
        "Architected modular data validation pipelines bridging legacy systems with modern RESTful APIs, ensuring data integrity across the SDLC.",
        "Implemented Automated CI/CD Workflows and standardized testing protocols, significantly reducing production bugs and rollback rates.",
        "Designed and maintained responsive, dynamic UI components using React.js to provide real-time visibility into backend configurations.",
        "Refactored monolithic legacy codebases into maintainable, object-oriented modules while enforcing strict security and performance standards.",
        "Researched and prototyped LangGraph-based AI Agents to automate repetitive business rule validation tasks, reducing manual QA effort by 35% through intelligent tool-use and reflection loops."
      ]
    },
    {
      "title": "Software Developer (Full Stack)",
      "company": "QRsay.com",
      "location": "Remote, India",
      "date": "Jul. 2023 - May 2025",
      "items": [
        "Managed the full software life cycle for a high-traffic Food E-commerce platform using Python, Node.js, and MongoDB.",
        "Executed database tuning and indexing strategies, achieving a 40% reduction in API response times for critical administrative dashboards.",
        "Developed real-time order processing systems and event-driven architectures using Kafka to synchronize data across multiple distributed outlets.",
        "Built secure payment gateway integrations and authentication modules with a focus on robust cybersecurity and data privacy.",
        "Engineered modular frontend components in React.js to deliver a seamless and performant user experience across devices.",
        "Designed and deployed a ReAct-pattern AI Agent integrated with the platform's inventory API to autonomously handle stock replenishment recommendations, menu optimization suggestions, and customer query resolution — reducing support ticket volume by 28%."
      ]
    }
  ],
  "education": [
    {
      "degree": "B.Tech in Computer Science and Engineering",
      "institution": "Dr. A.P.J. Abdul Kalam Technical University",
      "location": "Lucknow, India",
      "date": "Sep. 2020 - Jul. 2024",
      "items": [
        "CGPA: 8.81 (Aggregate) | College Topper (Rank 1)",
        "Rank 1 in College Coding Competition (2022)"
      ]
    },
    {
      "degree": "Senior Secondary (Class 12th) - CBSE",
      "institution": "DDPS, Sanjay Nagar",
      "location": "Ghaziabad, India",
      "date": "2020",
      "items": [
        "Percentage: 97% | School Topper (Rank 1)",
        "IIT JEE Advanced 2020: AIR 11870 (Top 1%)"
      ]
    }
  ],
  "projects": [
    {
      "name": "Oriz — 1000+ Free Online Tools Platform",
      "tech": "TypeScript, React, Astro, Python, Cloudflare Workers, Firebase, Razorpay",
      "link": "oriz.in",
      "featured": true,
      "items": [
        "Engineered a production-grade full-stack platform (oriz.in) with 192+ client-side tools across 8 categories using Astro, React, TypeScript, and Tailwind CSS, deployed on Cloudflare Pages.",
        "Built a real-time data API marketplace with 69 Python web scrapers across finance, crypto, weather, sports, and news domains, orchestrated by 5 GitHub Actions CI/CD pipelines with scheduled cron jobs.",
        "Integrated 10 AI/LLM providers into a unified chatbot interface with provider-agnostic abstraction and intelligent fallback routing.",
        "Architected multi-cloud backend: Firebase (Auth + Firestore), Supabase, Turso (LibSQL), Upstash Redis, Cloudflare R2, Algolia Search, Sanity CMS, and Razorpay payment gateway with webhook-driven order verification.",
        "Implemented 40+ cryptographic hash algorithms, client-side encryption (AES/DES/3DES/RC4), Kinde Auth (PKCE), Firestore security rules, and 100% client-side processing for maximum user privacy.",
        "Built 8 serverless edge functions on Cloudflare Workers handling comments, ratings, file uploads (R2), email dispatch, reCAPTCHA verification, payment webhooks, and view tracking.",
        "Embedded an Agentic AI Assistant with tool-calling capabilities into the platform, enabling users to invoke any of the 192+ tools via natural language commands — the agent autonomously selects, chains, and executes the correct tools to fulfill multi-step user requests."
      ]
    },
    {